{
  "schemaVersion": 1,
  "decisionId": "DEC-2026-07-18-add-execution-profiles-select-execution-pro-4a7c",
  "commandRunId": "RUN-2026-07-18-chaos-propose-add-execution-profiles-9b1e2f",
  "changeId": "add-execution-profiles",
  "sourceCommand": "chaos:run",
  "interactionType": "single-choice-decision",
  "state": "waiting",
  "title": "Select the execution profile for add-execution-profiles",
  "context": "The risk x execution-profile model decouples assurance (light/standard/strict) from ceremony (micro/compact/full). This change is prompt-layer only and touches no runtime code, but it still runs under the standard risk level. Choosing the execution profile determines how many sessions, decision stops, and reports the lifecycle will spend. Pick the profile that matches the change's blast radius.",
  "recommendation": "compact: the change is small and prompt-only, so full ceremony is not warranted, but the standard risk level still requires the full gate set.",
  "recommendedOptionId": "profile-compact",
  "options": [
    {
      "id": "profile-micro",
      "label": "micro",
      "description": "Single session, minimal stops, one summary-first report. For trivial, low-risk edits.",
      "consequence": "Fastest path, but batches decisions aggressively and may under-document a change that later needs an audit trail.",
      "risk": "Too light for a change that gates downstream work.",
      "recommended": false
    },
    {
      "id": "profile-compact",
      "label": "compact",
      "description": "Consolidated sessions, one consolidated report, batched independent decisions, full gate set retained.",
      "consequence": "Keeps full assurance while removing repeated ceremony; roughly two sessions and four stops for a small change.",
      "risk": "None material for a prompt-only change.",
      "recommended": true
    },
    {
      "id": "profile-full",
      "label": "full",
      "description": "Every phase in its own session with a per-phase report. For high blast-radius or strict-risk changes.",
      "consequence": "Maximum auditability at maximum token and interaction cost.",
      "risk": "Ceremony overhead disproportionate to a prompt-only change.",
      "recommended": false
    }
  ],
  "requiresRationale": true,
  "independent": false,
  "blocks": [],
  "createdAt": "2026-07-18T10:15:30+02:00",
  "expiresAt": null,
  "createdBy": "chaos:run",
  "metadata": {
    "confidence": "MEDIUM",
    "knowledgeType": "INFERENCE",
    "riskLevel": "standard"
  }
}
